{
  "schema_version": "1.0.0",
  "run_id": "arm-a17-C1-r1",
  "protocol_version": "1.0.0",
  "base_commit": "b423a159e2107ee4c06e4a899e9fbf1bd01a70dd",
  "arm_id": "arm-a17",
  "task_id": "C1",
  "replicate_id": "r1",
  "candidate_source": "retained://candidate-package",
  "candidate_version": "exact-version-or-commit",
  "candidate_package_sha256": "aaaaaaaaaaaaaaaaaaaaaaaaaaaaaaaaaaaaaaaaaaaaaaaaaaaaaaaaaaaaaaaa",
  "codex_model": "PINNED_MODEL_SNAPSHOT_BEFORE_EXECUTION",
  "reasoning_effort": "PINNED_REASONING_EFFORT_BEFORE_EXECUTION",
  "environment": "isolated-worktree-and-browser-profile",
  "permissions": ["repository-read-write", "local-browser"],
  "started_at_utc": "2026-09-09T00:00:00Z",
  "ended_at_utc": "2026-09-09T00:00:01Z",
  "input_sha256": "bbbbbbbbbbbbbbbbbbbbbbbbbbbbbbbbbbbbbbbbbbbbbbbbbbbbbbbbbbbbbbbb",
  "output_sha256": "cccccccccccccccccccccccccccccccccccccccccccccccccccccccccccccccc",
  "zero_cost_receipt_sha256": null,
  "native_imagegen_availability_sha256": "dddddddddddddddddddddddddddddddddddddddddddddddddddddddddddddddd",
  "observed_quota": "normal included Codex limit",
  "tool_receipt_ids": [],
  "scorer_versions": ["fixture-grounded-v1", "human-rubric-v1"],
  "completion_state": "complete",
  "failure_reason": null,
  "elapsed_seconds": 1,
  "token_usage": 0,
  "tool_call_count": 0,
  "free_quota_consumption": "not measured"
}
